{"$schema":"https://json-schema.org/draft/2020-12/schema","$id":"https://nexa.local/starbench/pricing-snapshot-ref-v0.1.schema.json","title":"Pricing Snapshot Ref V0.1","type":"object","additionalProperties":false,"required":["schema_version","record_type","snapshot_ref","authority","provider","model","billing_mode","snapshot_version","snapshot_timestamp","freshness_status","currency","pricing_components_ref","metadata"],"properties":{"schema_version":{"const":"0.1"},"record_type":{"const":"PRICING_SNAPSHOT_REF"},"snapshot_ref":{"type":"string","minLength":1},"authority":{"const":"03-01 AI资产成本"},"provider":{"type":["string","null"]},"model":{"type":["string","null"]},"billing_mode":{"const":"API_TOKEN_BILLED"},"snapshot_version":{"type":["string","null"]},"snapshot_timestamp":{"type":["string","null"],"format":"date-time"},"freshness_status":{"enum":["CURRENT","STALE","UNKNOWN"]},"currency":{"type":["string","null"]},"pricing_components_ref":{"type":["string","null"]},"metadata":{"type":"object"}}}