{"schema_version":"0.1","record_type":"PRICING_SNAPSHOT_REF","snapshot_ref":"pricing-fixture-ref","authority":"03-01 AI资产成本","provider":"fixture-api-provider","model":"fixture-api-model","billing_mode":"API_TOKEN_BILLED","snapshot_version":"fixture-v0","snapshot_timestamp":"2025-01-01T00:00:00.000Z","freshness_status":"STALE","currency":"CNY","pricing_components_ref":"03-fixture-components-stale","metadata":{"source_class":"TEST_FIXTURE","contains_price_values":false}}