{"schema_version":"0.1","record_type":"PRICING_SNAPSHOT_REF","snapshot_ref":"pricing-fixture-ref","authority":"03-01 AI资产成本","provider":null,"model":null,"billing_mode":"API_TOKEN_BILLED","snapshot_version":null,"snapshot_timestamp":null,"freshness_status":"UNKNOWN","currency":null,"pricing_components_ref":null,"metadata":{"source_class":"TEST_FIXTURE","contains_price_values":false}}